{
  "$defs": {
    "ArticleStatus": {
      "enum": [
        "ok",
        "fetch_failed",
        "extract_failed",
        "robots_denied"
      ],
      "title": "ArticleStatus",
      "type": "string"
    },
    "FailureCode": {
      "description": "Stable failure vocabulary for item-health rows.\n\n**Membership is one member per knob an operator turns, not one per gate.**\nFour HTTP members answer to one fetch, because the fix for a 404 is not the\nfix for a rate limit. `output_truncated` and `labels_truncated` are the two\noutput budgets, derived from two different grammars, for the same reason.",
      "enum": [
        "not_attempted",
        "robots_denied",
        "robots_unreachable",
        "blocked_address",
        "http_client_error",
        "http_rate_limited",
        "http_server_error",
        "network_error",
        "no_text",
        "no_title",
        "too_short",
        "not_prose",
        "boilerplate",
        "paywalled",
        "unsupported_form",
        "model_unreachable",
        "model_refused",
        "model_timed_out",
        "context_exceeded",
        "output_truncated",
        "labels_truncated",
        "bad_shape",
        "length_out_of_range",
        "copied_source",
        "leaked_address",
        "shard_out_of_time",
        "unknown"
      ],
      "title": "FailureCode",
      "type": "string"
    },
    "SourceForm": {
      "enum": [
        "article",
        "abstract"
      ],
      "title": "SourceForm",
      "type": "string"
    },
    "SourceTier": {
      "description": "The tier IS the ranking weight (docs/architecture/sources/discovery.md).",
      "enum": [
        1,
        2,
        3
      ],
      "title": "SourceTier",
      "type": "integer"
    },
    "TitleSource": {
      "description": "Which stranger's string the published headline came from.\n\nBoth are untrusted, and they are not trusted equally. The feed is a source\nsomebody chose and the page is whoever answered the address, so the feed is\nread first and the page only when the feed said nothing - order is a\ncontrol, and a page can never displace a headline we were given. The page\npath is then held to a tighter bound than the feed path and refused over it\nrather than cut. So this field records the outcome of a trust decision\nrather than provenance alone: `page` says the more attacker-controlled of\nthe two strings is the one on the page.",
      "enum": [
        "feed",
        "page"
      ],
      "title": "TitleSource",
      "type": "string"
    }
  },
  "$id": "article.schema.json",
  "$schema": "https://json-schema.org/draft/2020-12/schema",
  "additionalProperties": false,
  "changelog": [
    {
      "change": "FailureCode gained model_timed_out and shard_out_of_time.",
      "version": "2026-09-15T22:10",
      "why": "Both were being reported under a name that sends an operator to the wrong place."
    },
    {
      "change": "The embedded failure vocabulary gained model_refused.",
      "version": "2026-09-15T20:00",
      "why": "It follows item-health-row, where the vocabulary is declared."
    },
    {
      "change": "title_source records a trust decision, not provenance alone.",
      "version": "2026-09-15T12:00",
      "why": "A page headline and a feed headline are not equally trustworthy."
    },
    {
      "change": "Added title_source: feed or page, the headline's provenance.",
      "version": "2026-09-15T06:19",
      "why": "Extract now falls back to the page's own headline when the feed carried none."
    },
    {
      "change": "Earlier changes are in this file's git history.",
      "version": "2026-08-21",
      "why": "A changelog says what moved lately; git is the archive."
    }
  ],
  "description": "The Extract stage's output payload, one per item.",
  "properties": {
    "brief": {
      "default": false,
      "description": "True when the source is short enough that summarize uses the brief tier.",
      "title": "Brief",
      "type": "boolean"
    },
    "canonical_url": {
      "description": "The address after canonicalisation. url_key derives from it.",
      "maxLength": 2048,
      "pattern": "^https?://[^\\s\\\"'<>\\\\]+$",
      "title": "Canonical Url",
      "type": "string"
    },
    "carried_by": {
      "default": 1,
      "description": "Independent sources that carried this story today.",
      "minimum": 1,
      "title": "Carried By",
      "type": "integer"
    },
    "desk": {
      "anyOf": [
        {
          "pattern": "^[a-z0-9]+(?:-[a-z0-9]+)*$",
          "type": "string"
        },
        {
          "type": "null"
        }
      ],
      "default": null,
      "description": "Where the digest publishes this story, read off the whole article rather than off the feed that carried it. Null is nothing having said, and the digest falls back to `vertical`; a null is never read as a desk.",
      "title": "Desk"
    },
    "entities": {
      "items": {
        "pattern": "^[a-z0-9]+(?:-[a-z0-9]+)*$",
        "type": "string"
      },
      "title": "Entities",
      "type": "array"
    },
    "events": {
      "items": {
        "pattern": "^[a-z0-9]+(?:-[a-z0-9]+)*$",
        "type": "string"
      },
      "title": "Events",
      "type": "array"
    },
    "extractor_version": {
      "minLength": 1,
      "title": "Extractor Version",
      "type": "string"
    },
    "failure_code": {
      "anyOf": [
        {
          "$ref": "#/$defs/FailureCode"
        },
        {
          "type": "null"
        }
      ],
      "default": null,
      "description": "Typed extract failure, or a recorded extract signal on an ok article."
    },
    "failure_detail": {
      "anyOf": [
        {
          "maxLength": 500,
          "minLength": 1,
          "type": "string"
        },
        {
          "type": "null"
        }
      ],
      "default": null,
      "title": "Failure Detail"
    },
    "fetched_at": {
      "pattern": "^\\d{4}-\\d{2}-\\d{2}T\\d{2}:\\d{2}:\\d{2}Z$",
      "title": "Fetched At",
      "type": "string"
    },
    "item_id": {
      "pattern": "^[a-z0-9]+(?:-[a-z0-9]+)*-(?:[0-9]{2,}|[0-9a-hjkmnp-tv-z]{16})$",
      "title": "Item Id",
      "type": "string"
    },
    "lenses": {
      "items": {
        "pattern": "^[a-z0-9]+(?:-[a-z0-9]+)*$",
        "type": "string"
      },
      "title": "Lenses",
      "type": "array"
    },
    "published_at": {
      "anyOf": [
        {
          "pattern": "^\\d{4}-\\d{2}-\\d{2}T\\d{2}:\\d{2}:\\d{2}Z$",
          "type": "string"
        },
        {
          "type": "null"
        }
      ],
      "default": null,
      "title": "Published At"
    },
    "rank_score": {
      "minimum": 0.0,
      "title": "Rank Score",
      "type": "number"
    },
    "sanitizer_version": {
      "minLength": 1,
      "title": "Sanitizer Version",
      "type": "string"
    },
    "secondary_desk": {
      "anyOf": [
        {
          "pattern": "^[a-z0-9]+(?:-[a-z0-9]+)*$",
          "type": "string"
        },
        {
          "type": "null"
        }
      ],
      "default": null,
      "description": "The one other desk this article has a claim to, read off the same article `desk` is. It is where the day sends the story when the desk it is on is over its ceiling. One, never a list: a story on four desks is a story on no desk. Null is nothing having said, and the day falls back to `vertical`; a null is never read as a second desk and never as 'none'.",
      "title": "Secondary Desk"
    },
    "source_form": {
      "$ref": "#/$defs/SourceForm",
      "default": "article",
      "description": "Declared by the feed config. Never inferred from extracted text."
    },
    "source_id": {
      "description": "The feed that carried it.",
      "pattern": "^[a-z0-9]+(?:-[a-z0-9]+)*$",
      "title": "Source Id",
      "type": "string"
    },
    "source_url": {
      "description": "The address as discovered.",
      "maxLength": 2048,
      "pattern": "^https?://[^\\s\\\"'<>\\\\]+$",
      "title": "Source Url",
      "type": "string"
    },
    "source_word_count": {
      "anyOf": [
        {
          "minimum": 0,
          "type": "integer"
        },
        {
          "type": "null"
        }
      ],
      "default": null,
      "description": "Words in the extracted body before `extract.truncation_cap_tokens` cut it. A count, never the text: the pre-cap body is not kept and is not ours to republish. None on a payload written before the field existed.",
      "title": "Source Word Count"
    },
    "status": {
      "$ref": "#/$defs/ArticleStatus"
    },
    "text": {
      "anyOf": [
        {
          "type": "string"
        },
        {
          "type": "null"
        }
      ],
      "default": null,
      "description": "Sanitized text. Never republished.",
      "title": "Text"
    },
    "tier": {
      "$ref": "#/$defs/SourceTier"
    },
    "title": {
      "anyOf": [
        {
          "maxLength": 500,
          "minLength": 1,
          "type": "string"
        },
        {
          "type": "null"
        }
      ],
      "default": null,
      "title": "Title"
    },
    "title_source": {
      "anyOf": [
        {
          "$ref": "#/$defs/TitleSource"
        },
        {
          "type": "null"
        }
      ],
      "default": null,
      "description": "Where `title` came from: the feed entry, or the fetched page's own metadata when the feed carried none. Both are untrusted and they are not trusted equally - the feed is read first because it is the less attacker-controlled string, and the page path is held to a tighter bound and refused over it rather than cut. So this is the outcome of a trust decision, not provenance alone. Null on a failed payload, which publishes no headline, and on an ok payload written before the field existed."
    },
    "token_count": {
      "default": 0,
      "minimum": 0,
      "title": "Token Count",
      "type": "integer"
    },
    "truncated": {
      "default": false,
      "title": "Truncated",
      "type": "boolean"
    },
    "truncated_at_tokens": {
      "anyOf": [
        {
          "minimum": 1,
          "type": "integer"
        },
        {
          "type": "null"
        }
      ],
      "default": null,
      "title": "Truncated At Tokens"
    },
    "url_key": {
      "description": "sha256 of canonical_url. Identity for dedupe and skip - a field, never a path.",
      "pattern": "^[0-9a-f]{64}$",
      "title": "Url Key",
      "type": "string"
    },
    "version": {
      "default": "2026-09-15T22:10",
      "pattern": "^\\d{4}-\\d{2}-\\d{2}(?:T\\d{2}:\\d{2}(?::\\d{2})?)?$",
      "title": "Version",
      "type": "string"
    },
    "vertical": {
      "description": "The vertical the carrying feed declares about itself, copied from the source config and never read out of the article. `item_id` is addressed from it, so it may not be repointed - see `_identity_is_rebuilt_not_trusted` below.",
      "pattern": "^[a-z0-9]+(?:-[a-z0-9]+)*$",
      "title": "Vertical",
      "type": "string"
    },
    "word_count": {
      "default": 0,
      "description": "Words in `text`, after the cap.",
      "minimum": 0,
      "title": "Word Count",
      "type": "integer"
    }
  },
  "required": [
    "item_id",
    "url_key",
    "source_url",
    "canonical_url",
    "source_id",
    "tier",
    "vertical",
    "rank_score",
    "fetched_at",
    "status",
    "extractor_version",
    "sanitizer_version"
  ],
  "title": "Article",
  "type": "object",
  "version": "2026-09-15T22:10"
}
